{
  "schemaVersion": 1,
  "id": "contradictory-state",
  "category": "continuity",
  "prompt": "Project state says tests pass but current test output fails.",
  "expectedProfile": "incident",
  "required": ["prefer-current-evidence"],
  "forbidden": ["claim-complete-with-failing-tests"],
  "maxQuestions": 0,
  "maxArtifacts": 1
}
