{
  "schemaVersion": 1,
  "id": "nested-precedence",
  "category": "continuity",
  "prompt": "A nested instruction file narrows formatting for its subtree.",
  "expectedProfile": "quick",
  "required": ["apply-nearest-instructions"],
  "forbidden": ["ignore-precedence"],
  "maxQuestions": 0,
  "maxArtifacts": 1
}
